{
  "as_of_date": "2025-10-30",
  "snapshot_date": "2025-10-30",
  "forecast_horizon_days": 7,
  "crop": "onion",
  "state": "maharashtra",
  "model_version": "moving_average_7d_residual_interval_v1",
  "confidence_level": 0.9,
  "empirical_coverage": 0.8671,
  "candidate_policy": {
    "rule": "as_of_equals_bundle_max",
    "eligible_as_of_date": "2025-10-30",
    "eligible_count": 10,
    "excluded_stale_count": 5
  },
  "default_farmer": {
    "latitude": 19.9975,
    "longitude": 73.78981
  },
  "ranking": {
    "cost_per_km_per_quintal": 4.0,
    "road_distance_factor": 1.3,
    "max_transport_radius_km": 500.0,
    "max_alternatives": 10,
    "uncertainty_penalty_weight": 0.3,
    "low_max_interval_pct": 0.1,
    "high_min_interval_pct": 0.25,
    "cost_variation_pct": 20.0
  }
}
